image,total,safe,unsafe,score
"Builders working stock photo_ Image of equipment, sunshine - 19457912.jpeg",0,0,0,0
Diverse group of workers wearing safety gear and helmets at a construction site emphasizing the importance of workplace safety on world day for safety _ Premium AI-generated image.jpeg,4,4,0,100
Front Back View Modern Safety Vest 3D Isolated Mockup.jpeg,3,3,0,100
Warehouse worker Photos - Download Free High-Quality Pictures _ Freepik.jpeg,1,1,0,100
"Yellow Reflective Safety Vest, X-Large.jpeg",0,0,0,0
